Front,Back
What are the application areas for BMB graduates in the biotechnology and pharmaceutical industry?,"- Drug discovery, genetic engineering, and the development of biologics.
- Roles include biotech research, bioprocessing, and drug production."
What are the roles of BMB graduates in medical and clinical research?,"- Genetic testing, molecular diagnostics, and clinical research.
- Involvement in personalized medicine, gene therapy, and genetic counseling."
How do BMB graduates contribute to agriculture and environmental science?,"- GMOs, biopesticides, and biofertilizers for sustainable agriculture.
- Bioremediation and environmental conservation."
What are the roles of BMB graduates in academic research?,"- Roles in basic and applied research in molecular genetics, protein biochemistry, and genomics."
How do BMB graduates contribute to forensic science?,"- DNA profiling, genetic fingerprinting, and criminal investigations."
What are the current prospects of BMB in precision medicine and genomic medicine?,"- Cancer Treatment: Targeted therapies (e.g., HER2 inhibitors for breast cancer).
- Pharmacogenomics: Personalized drug prescriptions based on genetic makeup (e.g., Warfarin dosage adjustments)."
How is BMB applied in gene therapy and genetic engineering?,"- CRISPR-Cas9: Gene editing for diseases like sickle cell anemia and muscular dystrophy.
- CAR-T Cell Therapy: Genetic modification of T-cells to fight leukemia and lymphoma."
What are the contributions of BMB to biopharmaceuticals and biotechnology in drug development?,"- mRNA Vaccines: Pfizer-BioNTech & Moderna COVID-19 vaccines.
- Monoclonal Antibodies: Treatments for autoimmune diseases and cancer (e.g., Pembrolizumab for melanoma)."
How does BMB contribute to regenerative medicine?,"- Stem Cell Therapy: Regrowing damaged tissues in neurodegenerative diseases and spinal cord injuries.
- 3D Bioprinting: Printing functional organs and tissues for transplantation."
What are the applications of BMB in molecular diagnostics and personalized healthcare?,"- Liquid Biopsy: Detects cancer through blood tests instead of invasive biopsies.
- PCR & Next-Gen Sequencing (NGS): Identifies infectious diseases, genetic disorders, and cancers."
What is the future of BMB in digital health and AI integration?,"- Machine learning models will predict disease risks and optimize drug discovery.
- Wearable biosensors and remote patient monitoring will improve chronic disease management."
How will advanced gene editing impact the future of BMB in medicine?,"- CRISPR and next-generation gene-editing tools will enable precise correction of genetic disorders (e.g., sickle cell anemia, cystic fibrosis).
- Personalized genetic therapies will target diseases like cancer and neurodegenerative conditions."
What is the future of BMB in bioprinting and organ regeneration?,"- 3D bioprinting will revolutionize organ transplantation by producing lab-grown tissues and organs.
- Stem cell-based therapies will aid in regenerating damaged tissues and treating conditions like heart disease and spinal cord injuries."
How will epigenetics and disease prevention shape the future of BMB?,"- Understanding gene-environment interactions will allow for proactive disease prevention.
- Epigenetic modifications (e.g., DNA methylation, histone modifications) will become therapeutic targets for conditions like cancer and metabolic disorders."
What is the future of BMB in next-generation vaccines and universal immunization?,"- AI-driven vaccine development will accelerate response to emerging pandemics.
- Universal flu and HIV vaccines will provide broad-spectrum protection."
What are the current prospects of BMB in personalized nutrition and nutrigenomics?,"- Nutrigenomics studies how genetic variations influence individual responses to nutrients.
- Epigenetics explores how diet can regulate gene expression, impacting metabolic health and disease risk."
How does BMB contribute to functional foods and bioactive compounds?,"- Identification of bioactive peptides, polyphenols, and probiotics with health benefits.
- Encapsulation technologies enhance the bioavailability of functional nutrients."
What are the applications of BMB in nutritional interventions for disease prevention?,"- Phytochemicals and antioxidants are being explored for their role in cancer prevention.
- Omega-3 fatty acids, probiotics, and vitamin D are linked to reduced inflammation and immune regulation."
How does BMB contribute to nutritional assessment and molecular diagnostics?,"- Development of biomarkers for assessing nutrient deficiencies and metabolic disorders.
- Wearable biosensors for real-time monitoring of glucose, ketones, and other metabolites."
What are the innovations in food production and sustainability driven by BMB?,"- Biotechnology in food production, including genetically modified organisms (GMOs) and precision fermentation.
- Lab-grown meat and alternative protein sources reduce environmental impact."
What is the future of BMB in further personalization through omics technologies?,"- Proteomics & Metabolomics: These help analyze biomarkers for metabolic health, allowing real-time tracking of nutritional responses.
- Microbiomics: The gut microbiome plays a crucial role in digestion, immunity, and even mood."
How will epigenetics and nutrition shape the future of BMB?,"- Diet influences gene expression without altering DNA sequences.
- Nutritional interventions targeting epigenetic markers may help prevent diseases like obesity, diabetes, and cancer."
What is the future of BMB in nutraceuticals and bioactive supplements?,"- Growing research in functional foods, probiotics, and bioactive compounds (e.g., polyphenols, omega-3s, and flavonoids) for disease prevention and health optimization.
- Personalized supplementation: AI-driven nutrient profiling to determine optimal doses of vitamins, minerals, and phytonutrients based on an individual’s metabolism and deficiencies."
How will AI and big data impact the future of BMB in nutritional science?,"- AI-powered dietary recommendations based on wearable tech, real-time glucose monitoring, and microbiome data.
- Machine learning models predicting how individuals respond to different diets, improving intervention strategies."
What are the current prospects of BMB in genetically modified (GM) crops and precision agriculture?,"- Increased Yield and Stress Resistance: GM crops are being engineered for higher yields, resistance to pests, herbicides, and climate stress (e.g., drought-resistant maize, Bt cotton).
- Nutritional Enhancement: Biofortification through GM technology (e.g., Golden Rice enriched with Vitamin A) is improving food security and public health."
How does BMB contribute to molecular breeding and marker-assisted selection (MAS)?,"- Disease Resistance: Disease-resistant cultivars (e.g., wheat resistant to rust fungi) are being developed through molecular markers, reducing reliance on chemical treatments.
- Hybrid Development: MAS is optimizing hybrid vigor in crops such as maize and wheat, ensuring better adaptability and yield stability."
What are the applications of BMB in pest and disease management?,"- Microbial Biopesticides: Genetically engineered microbes (e.g., Bacillus thuringiensis) are being used as environmentally friendly biocontrol agents.
- Early Disease Detection: Molecular diagnostics, such as PCR and biosensors, enable rapid identification of pathogens before outbreaks occur."
How does BMB contribute to soil health and fertilizer management?,"- Soil Microbiome Engineering: Manipulating soil microbial communities is improving nutrient cycling, organic matter decomposition, and plant growth.
- Genomics for Soil Quality Monitoring: DNA sequencing technologies are helping assess soil biodiversity and microbial composition to optimize fertilizer application."
What are the roles of BMB in livestock genomics and biotechnology?,"- Genetic Improvement of Livestock: Genomic selection is improving traits such as disease resistance, milk yield, and feed efficiency in cattle, poultry, and swine.
- Microbiome Research: Studies on gut microbiota in livestock are optimizing feed conversion efficiency and reducing methane emissions."
What is the future of BMB in next-generation genomic tools and CRISPR advances?,"- CRISPR-Cas9 & Prime Editing: Precision gene editing is enhancing crop resilience against pests, diseases, and environmental stresses.
- Gene Drives: Used for controlling invasive species and enhancing beneficial traits in plants."
How will synthetic biology and AI impact the future of BMB in agriculture?,"- AI & Machine Learning: Predictive models analyze soil health, weather patterns, and plant genetics for optimized farming.
- Genomic Big Data: Integration of sequencing data to breed high-performing, climate-resilient crops."
What are the future applications of BMB in sustainable biopesticides and bioherbicides?,"- Microbial Biopesticides: Engineered bacteria and fungi target specific pests while being environmentally safe.
- RNA-Based Biocontrol: RNA interference (RNAi) can silence pest and weed genes, reducing chemical pesticide reliance."
What are the roles of biochemists in clinical biochemistry and laboratory diagnostics?,"- Analyzing body fluids (blood, urine, cerebrospinal fluid) for biochemical markers (e.g., glucose, cholesterol, enzymes, electrolytes) to diagnose diseases like diabetes, liver disorders, and kidney diseases.
- Ensuring the proper functioning of automated biochemical analyzers.
- Collaborating with physicians to interpret test results and guide patient management."
What are the roles of biochemists in molecular diagnostics?,"- Conducting genetic and nucleic acid-based tests (e.g., PCR, RT-PCR, microarrays) to detect infectious diseases, hereditary conditions, and cancers.
- Developing and validating molecular biomarkers for disease prediction and personalized medicine.
- Performing DNA/RNA sequencing to identify mutations linked to genetic disorders."
What are the roles of biochemists in immunology and serology?,"- Detecting antibodies and antigens in blood samples to diagnose infections (e.g., HIV, hepatitis, COVID-19).
- Performing ELISA, Western blot, and flow cytometry to assess immune responses.
- Evaluating autoimmune disorders by analyzing specific immune markers."
What are the roles of biochemists in therapeutic drug monitoring (TDM)?,"- Measuring drug levels in patients to ensure safe and effective medication use (e.g., antibiotics, anticonvulsants, immunosuppressants).
- Assessing drug metabolism and pharmacokinetics in individuals for personalized therapy.
- Preventing drug toxicity and ensuring optimal therapeutic effects."
What are the roles of biochemists in quality control and standardization in diagnostic laboratories?,"- Implementing and maintaining quality assurance programs to ensure the accuracy and reliability of test results.
- Standardizing laboratory procedures and calibrating diagnostic equipment.
- Complying with regulatory guidelines (e.g., ISO, CLIA, CAP) for laboratory accreditation and proficiency testing."
What are the roles of biochemists in drug discovery and development?,"- Identify biological targets (e.g., proteins, enzymes, or genes) associated with diseases.
- Conduct biochemical screening and high-throughput screening (HTS) to identify lead compounds.
- Optimize drug candidates by understanding structure-activity relationships (SAR)."
What are the roles of biochemists in preclinical and clinical development?,"- Perform in vitro (cell-based) and in vivo (animal model) studies to assess drug efficacy and toxicity.
- Investigate pharmacokinetics (ADME: Absorption, Distribution, Metabolism, and Excretion) and pharmacodynamics (drug effects on the body).
- Support biomarker identification for monitoring drug effects in clinical trials."
What are the roles of biochemists in analytical chemistry and quality control?,"- Develop and validate analytical methods (e.g., chromatography, spectroscopy, mass spectrometry) for drug characterization.
- Ensure purity, potency, and stability of pharmaceutical products.
- Monitor batch-to-batch consistency during drug manufacturing."
What are the roles of biochemists in regulatory affairs and compliance?,"- Prepare and submit regulatory documents to health authorities (e.g., FDA, EMA).
- Ensure adherence to guidelines from regulatory bodies (ICH, WHO, etc.).
- Provide biochemical data to justify safety and efficacy claims."
What are the roles of biochemists in pharmacovigilance and drug safety?,"- Monitor adverse drug reactions (ADRs) and post-market surveillance data.
- Investigate molecular mechanisms underlying drug side effects.
- Conduct risk-benefit analyses of approved drugs."
What are the roles of biochemists in pharmaceutical R&D?,"- Identifying drug targets (proteins, enzymes, or genes linked to diseases).
- Developing and testing new drugs through in vitro and in vivo studies.
- Conducting pharmacokinetics and pharmacodynamics studies to understand drug absorption and metabolism."
What are the roles of biochemists in biotechnology R&D?,"- Engineering recombinant proteins for therapeutic and industrial applications.
- Developing gene-editing techniques (CRISPR, RNA interference).
- Improving bioprocessing techniques for large-scale production of biologics."
What are the roles of biochemists in environmental R&D?,"- Developing bioremediation techniques to clean up pollutants.
- Studying microbial degradation of toxic substances.
- Monitoring and controlling water and air quality using biochemical markers."
What are the roles of biochemists in agricultural R&D?,"- Developing genetically modified (GM) crops with higher yields and disease resistance.
- Improving biofertilizers and biopesticides for sustainable farming.
- Researching plant metabolism to enhance growth and resilience."
What are the roles of biochemists in diagnostics and clinical R&D?,"- Developing biomarkers for early disease detection.
- Improving diagnostic tests (e.g., PCR, ELISA, and rapid tests).
- Researching metabolic disorders and personalized medicine approaches."
What are the roles of biochemists in analytical testing and method development?,"- Developing and optimizing analytical methods for testing raw materials, intermediates, and finished products.
- Utilizing techniques such as HPLC, GC, UV-Vis Spectroscopy, Mass Spectrometry, and ELISA to analyze chemical and biological samples.
- Validating methods to ensure accuracy, precision, specificity, and reproducibility."
What are the roles of biochemists in ensuring product consistency and stability?,"- Conducting stability studies to determine product shelf life and storage conditions.
- Monitoring biochemical properties to ensure consistency across batches.
- Investigating deviations and implementing corrective actions to maintain product integrity."
What are the roles of biochemists in monitoring impurities and contaminants?,"- Detecting and quantifying impurities, including heavy metals, microbial contaminants, and residual solvents in pharmaceuticals and food products.
- Ensuring compliance with safety limits set by regulatory bodies such as the FDA, WHO, and EPA.
- Identifying sources of contamination and recommending preventive measures."
What are the roles of biochemists in calibration and equipment maintenance?,"- Regularly calibrating and maintaining analytical instruments to ensure accuracy in test results.
- Troubleshooting instrument malfunctions and performing routine checks.
- Maintaining detailed documentation of equipment performance and calibration records."
What are the roles of biochemists in compliance with regulatory standards?,"- Ensuring adherence to Good Manufacturing Practices (GMP), Good Laboratory Practices (GLP), ISO standards, and FDA guidelines.
- Preparing and reviewing QC documentation, including Standard Operating Procedures (SOPs) and validation reports.
- Participating in internal and external audits to maintain regulatory compliance."
What are the roles of biochemists in ensuring compliance with regulatory standards in QA?,"- Helping companies adhere to regulations from agencies like the FDA, EMA, WHO, and ISO.
- Developing protocols to meet Good Manufacturing Practices (GMP), Good Laboratory Practices (GLP), and other industry standards.
- Conducting internal audits and inspections to ensure compliance and preparing documentation for regulatory submissions."
What are the roles of biochemists in the development and validation of analytical methods in QA?,"- Designing analytical methods to test raw materials, intermediates, and final products.
- Validating these methods to ensure accuracy, precision, specificity, and sensitivity in detecting impurities or variations.
- Working with chromatography (HPLC, GC), spectroscopy (UV-Vis, FTIR, NMR), and biochemical assays to assess product quality."
What are the roles of biochemists in monitoring and ensuring product quality in QA?,"- Performing routine quality control (QC) tests on products to confirm consistency and compliance with specifications.
- Investigating out-of-specification (OOS) results and deviations to determine causes and corrective actions.
- Contributing to batch record reviews and ensuring proper documentation of all quality-related activities."
What are the roles of biochemists in ensuring product consistency and stability in QA?,"- Conducting stability studies to assess product shelf-life and recommend storage conditions.
- Analyzing changes in product composition over time due to environmental factors like temperature, humidity, and light exposure.
- Helping in formulation optimization to enhance product stability and effectiveness."
What are the roles of biochemists in risk management and process improvement in QA?,"- Participating in risk assessment to identify potential quality issues before they arise.
- Implementing process improvement strategies using Lean, Six Sigma, and other quality management tools.
- Contributing to troubleshooting and resolving quality issues in production and R&D settings."
What are the roles of biochemists in product knowledge and technical expertise in marketing and sales?,"- Providing in-depth knowledge of the chemical composition, functionality, and benefits of products.
- Helping sales teams understand the scientific basis of the product, making it easier to explain to customers.
- Supporting training programs for sales representatives to enhance their technical knowledge."
What are the roles of biochemists in bridging the gap between science and consumer communication?,"- Simplifying complex scientific information into digestible content for consumers and non-scientific stakeholders.
- Assisting in creating brochures, presentations, and digital content that effectively convey the product's benefits.
- Ensuring that marketing materials maintain scientific accuracy while being engaging and persuasive."
What are the roles of biochemists in supporting product launches and campaigns?,"- Providing insights into how a product works, its advantages, and its differentiators.
- Collaborating with marketing teams to develop compelling product narratives and educational materials.
- Participating in trade shows, product demonstrations, and promotional events to reinforce credibility."
What are the roles of biochemists in engaging with healthcare professionals?,"- Communicating scientific findings to doctors, pharmacists, and healthcare providers.
- Presenting clinical data, answering technical questions, and addressing concerns about product safety and efficacy.
- Contributing to the development of continuing medical education (CME) programs for professionals."
What are the roles of biochemists in contributing to marketing strategies?,"- Identifying trends and innovations that can influence product development and marketing tactics.
- Providing scientific insights that shape branding, positioning, and messaging strategies.
- Collaborating with regulatory teams to ensure compliance with health and safety regulations in marketing claims."
What are the roles of biochemists in crop improvement and plant biotechnology?,"- Developing genetically modified (GM) crops with improved resistance to pests, diseases, and environmental stressors like drought and salinity.
- Enhancing crop yield and nutritional value through biofortification techniques.
- Studying plant metabolism to improve photosynthesis efficiency and nutrient uptake."
What are the roles of biochemists in pest and disease management in agriculture?,"- Identifying biochemical pathways of plant-pathogen interactions to develop disease-resistant crops.
- Formulating bio-pesticides and natural plant protection agents as eco-friendly alternatives to chemical pesticides.
- Developing molecular diagnostics for early detection of plant diseases."
What are the roles of biochemists in soil health and fertility management?,"- Enhancing soil microbial activity through biofertilizers and organic amendments.
- Developing enzyme-based indicators to assess soil health and fertility.
- Improving nitrogen fixation in legumes by optimizing the interaction between plants and beneficial microbes (e.g., Rhizobium bacteria)."
What are the roles of biochemists in animal husbandry and livestock nutrition?,"- Formulating nutritionally balanced animal feeds to enhance livestock growth and productivity.
- Developing probiotics and prebiotics to improve gut health and disease resistance in animals.
- Improving milk and meat quality through dietary supplementation with essential amino acids, vitamins, and minerals."
What are the roles of biochemists in bioremediation and sustainable agriculture practices?,"- Developing microbial and enzymatic methods for detoxifying polluted soils and water sources.
- Promoting the use of organic farming methods to reduce dependency on synthetic chemicals.
- Developing biodegradable and eco-friendly agricultural inputs, such as bio-based herbicides and fertilizers."
What is the future of BMB in precision medicine?,"- BMB will lead to personalized treatments, understanding genetic predispositions to diseases, and developing targeted therapies."